{
  "game_pack_id": "SYNTH-GAME-PACK-1",
  "items": [],
  "schema_version": "khshab.game-content-pack/v1",
  "source_binding": {
    "book_code": "SYNTH",
    "edition_id": "SYNTH-EDITION-1",
    "manifest_id": "SYNTH-MANIFEST-1",
    "manifest_sha256": "0c178294dd7ff776b73ad70324e79f46e589e65197a52558253014cdf44452b9",
    "source_id": "SYNTH-PRINT-1",
    "source_pdf_sha256": "b49bc5ae360c4f501f264c37b73f5d6b3772b09491b1a67ea9376e0b360f9f56"
  },
  "valuation_bundle_sha256": "a083b19d7a8aa93cadd9ffe8c1650ad7e97ab1a9b919dac9a0b7fcac0f902222"
}
